id,truth,location,sentence
48439,1,in the Android NDK,"  Use the arm-eabi-strip tool , provided in the Android NDK , to remove unnecessary debug symbols from native libraries ."
11964,3,in the Android Things Console documentation for more information on the available update channels and creating your own custom channels,  See how to select an update channel in the Android Things Console documentation for more information on the available update channels and creating your own custom channels .
39964,1,in the android.nfc.tech package,"  Obtain an instance of a TagTechnology , by calling one of the get factory methods of the classes in the android.nfc.tech package ."
18024,1,in the Arguments section of the Attributes panel.Empty name and default value fields appear,  Click Add -LRB- + -RRB- in the Arguments section of the Attributes panel.Empty name and default value fields appear .
196,1,in the Attributes window,"  In the Attributes window , locate the onClick property and select sendMessage -LSB- MainActivity -RSB- from the drop-down list ."
37729,1,in the background without draining too much battery,  Only use this sensor if you want to collect some rotation information in the background without draining too much battery .
9471,1,in the BrowseFragment implementation that displays the catalog browser,"  Finally , in the BrowseFragment implementation that displays the catalog browser , use the setHeaderPresenterSelector -LRB- -RRB- method to set the presenter for the row header , as shown in the following example ."
10777,1,in the car,  Provide audio playback for Auto - Create apps that let users browse and play music in the car .
28602,3,in the Cast documentation instead of using the MediaRouter framework directly,  Follow the directions in the Cast documentation instead of using the MediaRouter framework directly .
28591,3,in the Cast documentation instead of using the MediaRouter framework directly,  Follow the directions in the Cast documentation instead of using the MediaRouter framework directly .
43679,1,in the Company domain box,"  In the Company domain box , enter `` example.com '' ."
49229,1,in the Concurrency section of EffectiveJava,"  Internalize the recommendations in the Concurrency section of EffectiveJava , 2nd Edition ."
31753,1,in the ContentProviderOperation class,"  Batch access : You can create a batch of access calls with methods in the ContentProviderOperation class , and then apply them with ContentResolver.applyBatch -LRB- -RRB- ."
44662,1,in the Convert an app to a base feature module and Convert a feature module to an instant app guides,"  The recommended project structure , as discussed in the Convert an app to a base feature module and Convert a feature module to an instant app guides , prioritizes separating functionality into library modules , where the installable app and instant app depend on those library modules ."
25482,1,in the current layout,  You can call startDrag -LRB- -RRB- for any attached View in the current layout .
52342,1,in the DPC,"  With this library initialized in your DPC , you can use the Google Play EMM API in your EMM console and server to apply managed configurations to approved apps , instead of coding these tasks directly in the DPC ."
8346,1,in the Engine.onVisibilityChanged -LRB- -RRB- method,"  In the Engine.onVisibilityChanged -LRB- -RRB- method , start the custom timer if these two conditions apply :"
6735,1,in the example below,"  Implement the AmbientCallbackProvider interface , as in the example below ."
52248,1,in the example below -RRB- from the DPC Support Library,"  To simplify interaction with AccountManager , use the helper function -LRB- shown in the example below -RRB- from the DPC Support Library ."
37143,1,in the example code below,"  To perform this check , use the PackageManager.hasSystemFeature -LRB- -RRB- method , as shown in the example code below :"
35531,1,in the following code sample,"  To stop location updates , call removeLocationUpdates -LRB- -RRB- , passing it a LocationCallback , as shown in the following code sample :"
35522,1,in the following code sample,  Define a startLocationUpdates -LRB- -RRB- method as shown in the following code sample :
30768,1,in the following code snippet,"  If you want a column to have a different name , add the @ColumnInfo annotation to a field , as shown in the following code snippet :"
30851,1,in the following code snippet,"  If your app 's logic requires direct access to the return rows , you can return a Cursor object from your queries , as shown in the following code snippet :"
50123,1,in the following code snippet,"  If your app must use JavaScript interface support on devices running Android 6.0 -LRB- API level 23 -RRB- and higher , use HTML message channels instead of evaluateJavascript -LRB- -RRB- to communicate between a website and your app , as shown in the following code snippet :"
31758,1,in the following sections,  Batch access and modification via intents are described in the following sections .
49433,1,in the following two ways,  You can provide labels for elements in the following two ways :
39854,1,in the following ways,  You can create a TNF_MIME_MEDIA NDEF record in the following ways :
15600,3,in the Fragment class and implement it within the Activity,"  To allow a Fragment to communicate up to its Activity , you can define an interface in the Fragment class and implement it within the Activity ."
15525,1,in the Fragments/Activities themselves,"  The lifecycle-aware component can then be reused in other Fragments and Activities to avoid duplication of code , and reduce the amount of setup you need to do in the Fragments/Activities themselves ."
1796,1,in the framework,"  As a result , you can reduce your APK footprint by not compiling the ICU4J libraries into your APK ; instead , you can simply call out to them in the framework ."
54297,1,in the future or autoRenewing is set to true -RRB-,"  In this link 's click handler , add logic to determine whether the user has any non-expired subscriptions for your app -LRB- where expiryTimeMillis is in the future or autoRenewing is set to true -RRB- :"
43323,1,in the General tab,"  Under Dynamic features to deploy in the General tab , check thebox next to each dynamic feature module you want to include whendeploying your app ."
50917,1,in the Google APIs Console,  Go to the Library page in the Google APIs Console .
44003,1,in the Google APIs for Android,"  To do so , use the showInstallPrompt -LRB- -RRB- method in the Google APIs for Android ."
53966,1,in the Google Play Console,  You can use the order ID to manage refunds in the Google Play Console .
53802,1,in the Google Play Console help center,"  For more details about each of these options , refer to Add subscriptions and recurring charges in the Google Play Console help center ."
22922,1,in the group,"  Then , for each notification you want in the group , just call setGroup -LRB- -RRB- , passing the group name ."
24150,3,in the host component that will receive the action events from the dialog,  Then implement that interface in the host component that will receive the action events from the dialog .
36839,1,in the input method 's XML resource files,  Declare supportsSwitchingToNextInputMethod = `` true '' in the input method 's XML resource files .
14969,3,in the Intent that declares how -LRB- orwhether -RRB- the new activity should associate with the current task,"  When you call startActivity -LRB- -RRB- , you can include a flag in the Intent that declares how -LRB- orwhether -RRB- the new activity should associate with the current task ."
14993,1,in the intent that you deliver to startActivity -LRB- -RRB-,"  When starting an activity , you can modify the default association of an activity to its task by including flags in the intent that you deliver to startActivity -LRB- -RRB- ."
44914,1,in the internal storage,"  However , once the instant app is running on the user 's device , you can download additional data and store it in the internal storage ."
26448,1,in the layout and the items are animated automatically,"  Now , all you need to do is add , remove , or update items in the layout and the items are animated automatically :"
21811,1,in the Layout Editor,"  In the Layout Editor , select a TextView , and then under Properties , select fontFamily > More Fonts ."
5634,3,in the library project gives you a chance to put all your application initialization in one place,"  Having a starting activity defined in the library project gives you a chance to put all your application initialization in one place , so that each individual APK does n't have to re-implement `` universal '' tasks like initializing Analytics , running licensing checks , and any other initialization procedures that do n't change much from APK to APK ."
14678,3,in the lifecycle it is more appropriate to take control of shared system resources in the context of multi-window,  Think carefully about where in the lifecycle it is more appropriate to take control of shared system resources in the context of multi-window .
6328,1,in the manifest file of the watch app -LRB- e.g. the standalone watch app -RRB-,"  Specifically , to prevent bridging of notifications from a phone app , you can use a <meta-data> entry in the manifest file of the watch app -LRB- e.g. the standalone watch app -RRB- , as follows :"
55789,1,in the methods,"  To start with , you can use simple result-handling behaviors in the methods , such as displaying the license result in a dialog ."
42823,1,in the new WebView,"  In the new WebView , these return a value based on CSS pixels ."
38511,1,in the next section,"  Note that further downloads should be bundled , as described in the next section , Batch Transfers and Connections , and that these approximations will vary based on the connection type and speed , as discussed in Modify your Download Patterns Based on the Connectivity Type ."
22971,3,in the notification drawer and as a badge on the launcher icon,"  All notifications , regardless of importance , appear in non-interruptive system UI locations , such as in the notification drawer and as a badge on the launcher icon , though you can modify the appearance of the notification badge ."
25206,1,in the onCreateOptionsMenu -LRB- -RRB- method of your activity,"  To display the SearchView in the app bar , inflate the XML menu resource -LRB- res/menu/options _ menu.xml -RRB- in the onCreateOptionsMenu -LRB- -RRB- method of your activity :"
2396,1,in the one XML file,"  As such , you can combine integer array resources with other simple resources in the one XML file , under one <resources> element ."
10965,3,in the onPlayFromSearch -LRB- -RRB- method when you have generated the audio content queue based on the user 's request,"  Note : To minimize driver distractions , immediately initiate audio content playback in the onPlayFromSearch -LRB- -RRB- method when you have generated the audio content queue based on the user 's request ."
24259,1,in the onPrepareOptionsMenu -LRB- -RRB- method,"  If you want to modify the options menu based on events that occur during the activity lifecycle , you can do so in the onPrepareOptionsMenu -LRB- -RRB- method ."
34896,1,in the output of the command under Pending key/value backup,  Run adb shell dumpsys backup and check that your app is listed in the output of the command under Pending key/value backup .
32292,1,in the parent directory to the cursor,"  This snippet makes a new cursor with the requested columns , then adds information about every immediate child in the parent directory to the cursor ."
46991,3,in the Play Console and Android Studio to help improve your app quality,  Learn about Android vitals and improved tools in the Play Console and Android Studio to help improve your app quality .
43698,3,in the Project window and then select Run > Run ` instantapp ',  Click the instantapp module in the Project window and then select Run > Run ` instantapp ' .
54152,1,in the Purchase class,"  To view the types of product detail information that are available , see the list of methods in the Purchase class ."
47732,1,in the rare bucket,"  If an app is in the rare bucket , the system imposes strict restrictions on its ability to run jobs , trigger alarms , and receive high-priority FCM messages ."
27026,,in the resulting image,"  That is , you can look for the lowest quality setting before a user perceives noticeable distortion in the resulting image , or you can iteratively set image-distortion levels to learn their associated quality levels ."
41087,1,in the same room,"  Integrating this functionality into your application helps you provide a wide range of features , such as playing games with users in the same room , pulling images from a networked NSD-enabled webcam , or remotely logging into other machines on the same network ."
76,1,in the Select Hardware screen,"  In the Select Hardware screen , select a phone device , such as Pixel , and then click Next ."
14908,3,in the stack are never rearranged,"  Activities in the stack are never rearranged , only pushed and popped from the stack -- pushed onto the stack when started by the current activity and popped off when the user leaves it using the Back button ."
17000,1,in the StackWidget sample,"  In the StackWidget sample , if the user touches the top view , the app widget displays the Toast message `` Touched view n , '' where n is the index -LRB- position -RRB- of the touched view ."
25108,1,in the SUGGEST_COLUMN_QUERY column of your suggestions table,  Provide a unique query text string in the SUGGEST_COLUMN_QUERY column of your suggestions table .
157,1,in the tab bar,"  So return to the layout file by clicking activity_main.xml in the tab bar , and add the strings as follows :"
12792,1,in the table of supported hardware platforms,  Find your device in the table of supported hardware platforms .
8266,1,in the Target Android Devices window,"  In the Target Android Devices window , select only the Wear option , and in the list of SDK versions , select the latest available version ."
36700,1,in the UI,"  To ensure that your subtypes are labeled correctly in the UI , use % s to get a subtype label that is the same as the subtype 's locale label ."
9577,3,in the UI and maintains their state,"  You also need to specify a `` glue host '' that binds the glue to the playback fragment , draws the transport controls in the UI and maintains their state , and passes transport control events back to the glue ."
6463,1,in the upper-left drop-down,"  Alternatively , if an existing watch already is paired , in the upper-left drop-down , tap Add a New Watch ."
6998,1,in the Wear 2.0 module 's build.gradle file,"  If you have different APKs for Wear 1.0 and Wear 2.0 , be sure to set the higher minimum SDK version of 25 in the Wear 2.0 module 's build.gradle file ."
48723,0,in the world,"  It 's possible to write code that wins every performance test in the world , but still feels sluggish , hang or freeze for significant periods , or take too long to process input ."
40831,1,in the XML resource file,"  In the XML resource file , declare <usb-accessory> elements for the accessories that you want to filter ."
9705,1,in these subclasses,"  For details on what you can customize in these subclasses , see the documentation on GuidanceStylist and GuidedActionsStylist ."
8103,0,in this fashion allows your app to more selectively receive events,"  Implementing listeners in this fashion allows your app to more selectively receive events , improving its design and efficiency ."
33768,1,in this file,"  In this file , add the element <ContactsAccountType?xmlns:android=""http://schemas.android.com/apk/res/android""> ."
35722,1,in this guide,"  If geofences are n't being triggered when the device enters a geofence -LRB- the GEOFENCE_TRANSITION_ENTER alert is n't triggered -RRB- , first ensure that your geofences are registered properly as described in this guide ."
206,1,in this lesson,"  You can use intents for a wide variety of tasks , but in this lesson , your intent starts another activity ."
47060,3,in this page to diagnose and fix the problem,"  If your app is waking up the device excessively , you can use the guidance in this page to diagnose and fix the problem ."
55522,1,in this way,"  In this way , you can easily maintain a uniform implementation of licensing across all of your projects and maintain it centrally ."
46483,1,in those tests,"  Implement an idling resource in your app 's tests , and expose the part of your app 's implementation that needs to be synchronized in those tests ."
54377,1,in to your application,"  Subsequently , when the user starts up or logs in to your application , you should check if the user owns any outstanding consumable in-app products ; if so , make sure to consume and provision those items ."
46598,1,in use in the Sunflower demo app,  See it in use in the Sunflower demo app .
32876,3,in Using an intent to insert an event -- in thatscenario,"  Note that this rule does not apply ifyou 're inserting an event through the INSERT Intent , described in Using an intent to insert an event -- in thatscenario , you can use an RRULE in conjunction with DTSTART and DTEND , and the Calendar applicationconverts it to a duration automatically ."
21769,1,in XML,"  To define a range of text sizes and a dimension in XML , use the android namespace and set the following attributes :"
21779,1,in XML,"  To use preset sizes to set up the autosizing of TextView in XML , use the android namespace and set the following attributes :"
35542,1,in your activity 's onPause -LRB- -RRB- method,"  Set the shared preference in your activity 's onPause -LRB- -RRB- method , and retrieve the preference in onResume -LRB- -RRB- ."
6745,3,in your activity by using the WearableActivity class,  You can enable ambient mode in your activity by using the WearableActivity class :
43768,1,in your APK 's AndroidManifest.xml as follows,"  Each of your app 's manifest files must reference a unique package , so update the name in your APK 's AndroidManifest.xml as follows :"
33164,1,in your app,"  Note : To modify a single raw contact , consider sending an intent to the device 's contacts application rather than handling the modification in your app ."
10966,1,in your app,"  For a more detailed example on how to implement voice search to play audio content in your app , see the Universal Media Player sample ."
40733,1,in your app,"  In your app , you can specify whether users see a list of possible companion devices or only one suggestion for a companion device ."
35391,1,in your app,  You can use lifecycle-aware components to better manage the lifecycle of the activities in your app .
10827,1,in your app,"  You can register a broadcast receiver in your app , preferably in your MediaBrowserService implementation and listen for this intent and adjust advertisements , metadata , and UI buttons in your app to operate safely in a vehicle ."
49475,1,in your app,"  By providing increased contrast ratios between the foreground and background colors in your app , you make it easier for users to navigate within and between screens ."
10770,1,in your app 's manifest -LRB- AndroidManifest.xml -RRB-,"  In your app 's manifest -LRB- AndroidManifest.xml -RRB- , provide a reference to the Auto XML configuration file you created in the previous section ."
9867,3,in your app and requests to add it to the home screen,  User discovers a channel in your app and requests to add it to the home screen .
49472,3,in your app has a large enough touch target,"  To ensure that each focusable item in your app has a large enough touch target , set the android : minWidth and android : minHeight attributes of each interactive element to 48dp or greater :"
31261,1,in your app manifest that NFC is optional,"  To specify in your app manifest that NFC is optional , you use the following element :"
48504,1,in your app such as increased RAM use,"  Regular protobufs generate extremely verbose code , which can cause many kinds of problems in your app such as increased RAM use , significant APK size increase , and slower execution ."
30591,1,in your app that is accessible at install time,"  Tip : If you need to package a file in your app that is accessible at install time , save the file in your project 's res/raw / directory ."
1147,1,in your application,"  Once you provide a resource in your application , you can apply it by referencing its resource ID ."
55455,1,in your application,  Including the LVL library project in your application
23384,1,in your application,"  Once you define the information model , you can begin to define the contexts necessary to enable users to effectively discover , view , and act upon the data in your application ."
41065,1,in your application 's manifest file,"  You can specify an intent filter in your application 's manifest file , or do it in code as in the SipDemo sample application 's onCreate -LRB- -RRB- method of the application 's Activity :"
37337,1,in your application 's the execution,"  Do not attempt to start face detection in the onCreate -LRB- -RRB- method of your camera app 's main activity , as the preview is not available by this point in your application 's the execution ."
27156,3,in your application and do not obtain the smooth results you want,"  If you are running an animation in your application and do not obtain the smooth results you want , consider enabling hardware layers on your animated views ."
39106,1,in your application manifest file,  Declare the Bluetooth permission -LRB- s -RRB- in your application manifest file .
55872,1,in your applications,"  If you have questions or encounter problems while implementing or deploying publishing in your applications , please use the support resources listed in the table below ."
18032,1,in your code,"  In your code , create a bundle and pass it to thedestination using the navigate -LRB- -RRB- method :"
25940,1,in your code,"  Or to instead assign a state list animator to a view in your code , use the AnimatorInflater.loadStateListAnimator -LRB- -RRB- method , and assign the animator to your view with the View.setStateListAnimator -LRB- -RRB- method ."
26675,1,in your code instead,"  To enable window content transitions in your code instead , call the Window.requestFeature -LRB- -RRB- method :"
34164,3,in your code to get the thumbnail Bitmap,"  Call the loadContactPhotoThumbnail -LRB- -RRB- method in your code to get the thumbnail Bitmap , and use the result to set the photo thumbnail in your QuickContactBadge :"
49954,1,in your device Settings,"  In your device Settings , select Sound , then set the media volume to zero ."
52337,1,in your DPC,"  To use the Play EMM API , download the DPC Support Library and then enable managed configurations support in your DPC ."
27491,1,in your drawn object 's constructor,"  Do this in your drawn object 's constructor , so it is only done once ."
36479,3,in your game to allow users to personalize their own game controller mappings for game actions,  Tip : Consider providing a configuration screen in your game to allow users to personalize their own game controller mappings for game actions .
7675,1,in your IME implementation,"  In your IME implementation , set the boolean supportsSwitchingToNextInputMethod = true to enable your IME to support the switching mechanism -LRB- so that apps can switch to the next platform-supported IME -RRB- ."
44593,1,in your installed app,"  On devices runningAndroid 7.1 -LRB- API level 25 -RRB- and lower , you can transfer your Instant App ` sstorage data to your installed app by calling getInstantAppData -LRB- -RRB- in your installed app ."
44751,1,in your instant app,  Consider using Firebase Dynamic Links to wrap your URLs and guarantee that links always open in your instant app .
44239,1,in your instant app module 's build.gradle file,  Specify minSdkVersion = 21 in your instant app module 's build.gradle file
17555,1,in your layout as follows,  Use this event handler in your layout as follows :
17547,1,in your layout as shown in the following example,  You can use the adapter in your layout as shown in the following example .
55829,1,in your main Activity,"  In your main Activity , add a call to the checkAccess -LRB- -RRB- method of the LicenseChecker instance ."
30955,1,in your manifest,"  Similarly , you can advertise the data types that your activities support receiving from other applications by specifying them in your manifest ."
32048,1,in your manifest file,"  To change this , set permissions for your provider in your manifest file , using attributes or child elements of the <provider> element ."
7647,3,in your manifest file to make it a Wear-specific IME,"  To learn how to create an input method for wear , follow the guide to Creating an Input Method on handsets and add the following Google Play filters in your manifest file to make it a Wear-specific IME ."
31030,1,in your menu resource file,"  To get started with ShareActionProviders , define the android : actionProviderClass attribute for the corresponding <item> in your menu resource file :"
55731,1,in your Obfuscator,"  Before requesting new permissions for the sole purpose of acquiring device-specific information for use in your Obfuscator , consider how doing so might affect your application or its filtering on Google Play -LRB- since some permissions can cause the SDK build tools to add the associated <uses-feature> -RRB- ."
30981,1,in your own ContentProvider,"  Store the data in your own ContentProvider , making sure that otherapps have the correct permission to access your provider ."
37335,1,in your preview class,"  If you use the preview class shown in Creating a preview class , add your startFaceDetection -LRB- -RRB- method to both the surfaceCreated -LRB- -RRB- and surfaceChanged -LRB- -RRB- methods in your preview class , as shown in the sample code below ."
